text,isnegative,importance
You are gay or antisemmitian,1,0.5
"1 - If you are anti-semitian, than shave your head bald and go to the skinhead meetings",1,0.5
"3 - First and last warning, you fucking gay - I won't appreciate if any more nazi shwain would write in my page! I don't wish to talk to you anymore",1,0.5
"FUCK YOUR FILTHY MOTHER IN THE ASS, DRY",1,0.5
I'm Sorry,0,0.5
GET FUCKED UP. GET FUCKEEED UP.  GOT A DRINK THAT YOU CANT PUT DOWN???/ GET FUCK UP GET FUCKED UP.  I'M FUCKED UP RIGHT NOW,1,0.5
Stupid peace of shit stop deleting my stuff asshole go die and fall in a hole go to hell,1,0.5
@github is obviously a fistfuckee. He loves an arm up his ass,1,0.5
An Asshole That's Better Than You In Every Way,1,0.5
"Kindly keep your malicious fingers off of my above comment. Everytime you remove it, I will repost it",1,0.5
"All of my edits are good. Cunts like you who revert good edits because you're too stupid to understand how to write well, and then revert other edits just because you've decided to bear a playground grudge, are the problem.  Maybe one day you'll realise the damage you did to a noble project",1,0.5
Hi! I am back again,0,0.5
Stop undoing my edits or die,1,0.5
"Would you both shut up, you don't run wikipedia, especially a stupid kid",1,0.5
"UNBLOCK ME OR I'LL GET MY LAWYERS ON TO YOU FOR BLOCKING MY CONSTITUTIONAL RIGHT TO FREE SPEECH""",1,0.5
"You should be fired, you're a moronic wimp who is too lazy to do research. It makes me sick that people like you exist in this world",1,0.5
I think that your a Fagget get a life and burn in Hell I hate you,1,0.5
you are a stupid fuck,1,0.5
and your mother's cunt stinks,1,0.5
J*sus. Get a f*cking life,1,0.5
"Fuck you, block me, you faggot pussy",1,0.5
Kill all niggers,1,0.5
u r a tw@ fuck off u gay boy.U r smelly.Fuck ur mum poopie,1,0.5
this user is such a worthless goddamn faggot fuck you faggot,1,0.5
Fuck off,1,0.5
You are NOT an administrator. You DON'T have the authority to tell me what to do,1,0.5
"Well you are ridiculous, in fact I suspect that you are Calton, please block me, I dont care",1,0.5
Fuck you,1,0.5
Fuck you award go fuck yourself,1,0.5
"Keep your eye on it, no one cares, OK? People can put what they want on here, and clean it up all you want but no one cares. God, you're so freakin' stupid! @github",1,0.5
Thank you,0,0.5
You have no right to tell people to die in a fire. Just because that IP address is being used for vandilism does not mean you can talk to people like that. You are in fact a bigger loser than the person who you block,1,0.5
SO WATCH IT MOFO PIECE OF GARBAGE RACIST MOFO ASSHOLE.  IM TRYINBG TO BE NICE HERE SO TAKE WHAT i SAY AS A COMPLIMENT!Yamla,1,0.5
Be careful who you call a moron,1,0.5
I NEVER FUCKING MADE THIS MOTHER FUCKING ARTICLE I JUST FUCKING EDITED IT AND THAT WAS A FUCKING LONG TIME AGO FUCKING ASSHOLES! PISSING ME OFF @,1,0.5
Fucked with the wrong muchacho,1,0.5
Im a fucking bitch,1,0.5
I don't care what you say here. I don't believe one sentence anymore,1,0.5
HELLO HOW DO I GET SOMEBODY TO FIX SHIT AROUND HERE,1,0.5
"Why don't you get a life instead of sitting in front of your computer all day. The high priestess of knowledge, indeed",1,0.5
What a motherfucking piece of crap those fuckheads for blocking us,1,0.5
"You sir are an imbecile, and a pervert",1,0.5
Another crap article,1,0.5
Are you fucker mother fucker have nothing to do but block University computers. Go and suck cocks,1,0.5
HELLO,0,0.5
Your retarded bot,1,0.5
You Suck,1,1
Delete my user-id and all edits you evil Wikipedians,1,0.5
You wasted your own time! Take this advice with you: Pull your head out of your ass! Be real and don't spend the rest of your life sucking ass. Have a nice life! Goodbye,1,0.5
A few things to get straight,0,0.5
"Firstly, I do not like you. You look like a smug little prick to me",1,0.5
"Secondly, I do not like your ethnicity. Not one little bit. I'd like you to explain yourself on that count",1,0.5
"Thirdly, your dog is a bit of a bender",1,0.5
ok stop being lame. seriously. go watch pokemon,1,0.5
Don't peddle your crap please.  Hate to see another article get disputed for neutrality due to you,1,0.5
Here's an idea,0,0.5
"Go fuck yourself, cumshitter",1,0.5
"Fuck you, Smith. Please have me notified when you die. I want to dance on your grave",1,0.5
I shit on your face,1,0.5
fuck you,1,0.5
Just shut up and stay shut. Don't edit anymore,1,0.5
P.S. Are you a /b/tard,1,0.5
Ohhh I'm sorry did I hurt your little feelings,1,0.5
"LOL What a joke. I bet you feel pretty important, pathetic little wikipedia volunteer. Have fun living in your mother's basement drawing comic books, lowlife",1,0.5
Fuck off you murdering scum,1,0.5
YOU STUPID CRIMINAL,1,0.5
I told you already to leave me alone.why can't you fuck off and do your own fucking thing. Or do you find that hounding me is amusing. Id u do then you are a mothafuckin asshole and I will ban you,1,0.5
"Take care not to believe your own bullshit, see On Bullshit",1,0.5
You are wrong about everything,1,0.5
but for too stupid to notice. You are a lost cause. Your existence is a blemish,1,0.5
"WOULDN'T BE THE FIRST TIME BITCH. FUCK YOU I'LL FIND OUT WHERE YOU LIVE, SODOMIZE YOUR WIFE AND THEN BURN YOUR HOUSE DOWN. FUCK YOU YOU FUCKING QUEER",1,0.5
Where is the real vagina,1,0.5
fuck you @github,1,0.5
You go away you loser. Way to standup for you boyfriend @github. Make me go away,1,0.5
"How about this ""GO FUCK YOURSELF""",1,0.5
Whoever put a notices on my page. I will kill u,1,0.5
"Get off your high horse, or block me",1,0.5
"Fuck you faggot, I don't care if i get blocked, as long as everyone knows you are a dumb cunt",1,0.5
"Hey, you freaking hermaphrodite",1,0.5
"Worried that your cock wont fit in my ass anymore!, OMFK LOLZ HAHA I SAID PEEENIS GORF GORF GORF GORF",1,0.5
Keep your pathetic winking marks to your antiturkish ass,1,0.5
What a joker you are,1,0.5
"i have a dick, its bigger than yours! hahaha",1,0.5
watch out for @github he'll bite your dick off,1,0.5
"@github is a common prostitute, a sock-puppet",1,0.5
Fuck you people. The information of that can be found here,1,0.5
"@github you're a fag. Learn it, know it",1,0.5
Just a thought,0,0.5
"Fuck you both, I'm not interested in what either of you think",1,0.5
"SHUT UP, YOU FAT POOP, OR I WILL KICK YOUR ASS",1,0.5
Always good to have the ignorant and mentally defective getting together. Die soon,1,0.5
KISS MY DICK,1,0.5
YOU ARE ONE SAD LITTLE INDIVIDUAL,1,0.5
"Here are the supporting links you asked for, you stupid twit",1,0.5
If you are too lazy and full of yourself to read them in their entirety then I will just post the relevant sections here,1,0.5
"listen up, you narrow-eyed teacher living on minimum wage",1,0.5
"you can keep on doing your ""buck buck"" chicken trash talk, or perhaps you might wanna consider moving back to lemuria - the land where your kind of scum roams",1,0.5
You dumb motherfucker I am going to sue the shit out of you. Watch your back,1,0.5
Suck my dick. Thank you,1,0.5
"Man, you are really a dishonest person, disgusting",1,0.5
Poor editing? WTF is the matter with you,1,0.5
U bastard stop deletin' my shit u white trash cracker muthafucker. Fuck u u racist bitch. I hope u die,1,0.5
Bla bla bla. suck it @github,1,0.5
Try the official website then - shit head,1,0.5
"LMAO, that's basically saying ""wahhh he called me dumb me gunna block him""",1,0.5
"Nice use of those admin powers, now stay off my talk page",1,0.5
fuck you and your small penis,1,0.5
Fuck Your Mother! You is Son of a Bitch,1,0.5
What the hell do u mean,1,0.5
Who gave YOU the right to come and simply delete my all my writing??? ,1,0.5
You guys are full of yourselfs And the importance in your own minds. Maybe Drunk with power,1,0.5
"you're a fucking shit, the reason that i'm insulting is because , fuck you @github",1,0.5
When the funeral comes I will be the only one their and I will only be their to piss on your grave,1,0.5
"You have no friends in real life, what makes you think anyone on the internet will like you?  Take the hint, you're an a-hole",1,0.5
The first THREE were rejected out of hand and the following half a dozen where similarly ditched. I could produce ANOTHER fukkin half a dozen but it that wouldn't matter to a pure PoS paid scumbag would it,1,0.5
@github is a DICK-FUCK,1,0.5
"God, I just hate them so much. Lets hope they die",1,0.5
You won't find any creditable citations because such claim is a load of racist horse shit,1,0.5
Get your head out of your ass,1,0.5
stop leaving stupid harping messages for peopel that are nil to do with what you are talking about,1,0.5
"hey fuck you, who the fuck checks this page for vandalism. Get a fucking life you turd bag",1,0.5
Yo what the fuck is your problem fucking around with my page! leave it the fuck alone,1,0.5
"Oh GWH, you truly are the worst admin at @github. May God have mercy on your poor, pathetic, overweight, ugly soul",1,0.5
"Both the old and the new formatting are terrible (too deeply indented), but that should be handled separately",1,0.5
@github I actually search twice per line so I don't miss cases like #code Didn't want to mess with Regexes too much as it's easy to make stupid mistake,1,0.5
Is this actually needed,0,0.5
"In base64 the encoded data is stored as big endian like, and here it's written by #url (Edit: this is wrong ~#code) and not as #code). So I believe this change flips the order.~",0,0.5
"When I re-watched the video and the final decision was to leave it as #code for now as that is the current behavior, and then introduce the breaking change as part of .NET 7. I could be wrong, but that is what I saw/heard...happy to change it - if everyone agrees",0,0.5
"I would have thought component model syncs with the shell version and not editor version, but maybe I'm wrong there",0,0.5
"Also wrong first apostrophe, it should be before #code not before the (",0,0.5
Please put #code between apostrophes,0,0.5
start with either #code or #code so it gets sorted along other important/critical logs,0,0.5
I assumed no one would be crazy enough to recompile a mixed mode assembly for XI (since you can't just reuse a windows desktop lib like you can on macOS),0,0.5
I can add the check if you'd like though,0,0.5
So the major difference here is that we allocate #code aka #code directly in unmanaged memory. While originally we were using pinned managed memory #code,0,0.5
What was wrong with the original approach? Was it #code? Should that be #code,0,0.5
This comment is just me trying to properly understand what's going on here. It has absolutely no influence on mergeability of this PR :smile,0,0.5
"Ah, nvm, I read the diff completely wrong",0,0.5
"The main mechanism we have for issuing Disable commands is the IPC server, which currently is single-threaded. While not ideal because it is implicit, we have an implicit serialization of IPC commands",0,0.5
"That being said, I don't think there is anything that is wrong about having two rundowns happening at the same time. You may end up with duplicate information in both traces, but the runtime shouldn't run into any issues. The reader might need to be updated to handle duplicates if it doesn't already",0,0.5
"The things that should be exclusive are still wrapped in the spin lock, e.g., EP config changes, non-volatile state updates",0,0.5
"The previous version was working wrong with StackAllocation enabled, for reference types #code always returns #code that is not how many bytes it takes on the stack, to see how it was fixed search for #code",0,0.5
wrong casing,0,0.5
"Yes, I was wondering if we should do something about them as it seems like the netstandard2.0 ref assembly is wrong, no action to take on this PR though",0,0.5
We got the wrong PRs @github dirty pastebin lol,0,0.5
Arguments were passed in wrong order,0,0.5
Your thoughts match what I was thinking -- no single ordering is more correct than another. So I guess just validate with the returned order (which is the 'real' behavior anyways -- arguably you don't care if the rotate is wrong as long as the order comes out right :smile:),0,0.5
From the point of readability #code sucks,1,0.5
"As with any double-negative, you're forced to pause and do some mental calculations: *""ah, it's checking for position, then asserts that position is not good; no wait it asserts that it's not wrong, then proceeds — therefore this statement checks that the substring exists in the path string! Phew....""*",0,0.5
Rules are academic. In the end what counts is cost of maintenance. Replacing #code with #code improves readability and reduces possibility of bugs,0,0.5
This seems wrong.  I feel like we should have a virtual method on CompletionItem that incorporates this behavior.  DescriptionModifyingCompletionItem would override that behavior to defer to it's modified item.  etc. etc,0,0.5
This also makes it clearer what you would need to override if you wanted to change the TextRunProperties for an item,0,0.5
Heh. I had this open in multiple editors with both versions in each to directly compare where their execution differed. I did not notice that the wrong version had been saved 🐈 Thanks,0,0.5
"Well, looks there's still a problem: #url",0,0.5
The results there appear to be garbage but are all convieniently in the range of valid BSF results. The only thing I can think of that would cause that is the emitter encoding the wrong operand.  @github any ideas how that could happen,0,0.5
"Hi @github, @github, it looks like this went back (or at least still has) with the wrong value for the maximum usable address. I would still recommend tracking the VA hole here, but if you want to use the maximum value that can change, I'd strongly recommend at least using the _current_ max on x86, instead of one from a few years ago (before KPTI)",0,0.5
"I'm not crazy about this effective call arguments model. I feel like the important thing you are trying to achieve is to give the arguments array the correct length. But I'd almost rather you put undefined, rather than decorator.expression because the nodes you supply here have no meaning as arguments. The decorator.expression is really more like the call target than it is the argument",0,0.5
What's the motivation for the change here? True we don't require code to be explicit about #code in the tests but it's not wrong either,0,0.5
#url (Not sure if this still holds?),0,0.5
Just add #nullable disable at the top of the test file,0,0.5
"Sounds overkill,",1,0.5
"Quite the opposite. In my opinion, using nullable analysis in tests is an overkill. It simply introduces unnecessary overhead on every angle. A test doesn't have to handle every possible scenario. If it doesn't fail, there is nothing to get wrong about nullability, it is focused on a very specific scenario",0,0.5
"Good point. No matter what testing helper we use, they are being tested by using them in tests. And from efficiency stand point, they are introducing overhead. Out of curiosity, why enable it for test projects in the first place? Anyways, right now the compiler is happy, but I'll disable nullable if it introduce more unnecessary troubles for this file",0,0.5
"Since Orta's attempt to generate a playground for this failed, I tried testing this branch locally by installing it via #code",0,0.5
Attempting to compile,0,0.5
results in,0,0.5
"So it looks like the compiler isn't recognising the new #code syntax. At first I thought Yarn wasn't installing the correct version, but I can see the new baseline tests locally, so it seems to have installed correctly",0,0.5
What am I doing wrong? 😅,0,0.5
"Maybe a dumb question, but isn't there any way to ask SCHANNEL directly, ""do you support TLS 1.3?"" Seems like that should exist and would be a lot less fragile than the current approach",0,0.5
I think that code must rely on isDefinition too—at least the emacs code did when I first wrote it in 2016,0,0.5
"I could be wrong, but I don’t think this is true for VS Code",0,0.5
"Tagging subscribers to this area: @github, @github",0,0.5
See info in area-owners.md if you want to be subscribed,0,0.5
Mapping the package to #code would be wrong in servicing cases. Hence just removing the hardcoded value entirely,0,0.5
"That wasn't my understanding on the docs on INotify, though I'm far from a Linux expert. The way I read the docs they were talking about pathname which I read to mean only the directory passed in. If a file within that directory is a symlink outside the directory are you seeing that it's still watched? I guess child directories would be followed since those require independent additions",0,0.5
"Ah yes, the symlinks within the watched directory were being followed with my previous change because we are manually calling #code for each subdir when #code is set. Thus my statement was wrong. I have undone the changes that were causing following child symlinks by default, this in order to behave similar to windows",0,0.5
we could introduce an API and have that API throw on platforms where we can't honor it,0,0.5
"Agree, follow symlinks should not be the default, or at least should not be addressed by this PR, it would be a discussion of it's own",0,0.5
Do you imagine there are folks who would want to disallow this behavior,0,0.5
We already have a very similar discussion in the issue for symbolic link APIs,0,0.5
"It seems there is people in both sides of ""having follow semantics as the default"" or ""make follow links opt-in"" so I think it would not be great to allow that here",0,0.5
These values were automatically updated by running #code,0,0.5
@github @github @github Is the upgrade deps tool putting the wrong values here,0,0.5
Can we log a specific error when the specified cert is of the wrong type,0,0.5
"Once this bug gets fixed, this will be broken again",0,0.5
Thanks. I'll look into that,0,0.5
"FWIW, I think fallbacks like this are wrong way to fix trimming and AOT friendliness issues",0,0.5
It just needs to work well enough (or barely work) to enable people to try it out and give feedback. Seems like we need something a bit more creative here (like a check for IsDynamicCodeCompiled maybe),0,0.5
Using derived types is currently a PITA in the serialization layer.  Have been talking to heejae about improving that.  If/when we improve things there we can move over,0,0.5
"Using a #code element on each property, like this for the current one",0,0.5
I'm actually very opposed to that for the reason that comments invariably become desynced from code organization.   regions are part of the code and it is immediately visible when a new field is placed into the wrong region,0,0.5
@github I think something has gone wrong with the status checking when GitHub was having reliability issues earlier,0,0.5
"I restarted it, and it all passed, but still says it’s waiting for results",0,0.5
Could you merge it please,0,0.5
I might be wrong here but i think darc will update all the dependencies from the source repo to the target repo,0,0.5
"@github git says you are responsible for this... fibonacci is obviously called with the wrong number number of arguments, is this intentional",0,0.5
Coincidentally I copied a dead-package version property from System.Security.Principal.Windows with the wrong version 😆  Cleaning that up,0,0.5
any suggestions on how we should proceed with this PR,0,0.5
"The main issue I currently see is similar to what you mentioned, the #code method lives in user code so that means it has issues such as #code and what if someone has a library that uses GetProxy and they also use GetProxy from their own code? There will probably be a compiler error. This wouldn't be solved by making it internal because ""internals visible to"" is a thing",0,0.5
"Any thoughts? One crazy idea I have is allowing changing the ""GetProxy"" name, so you could somehow configure the generator to use ""GetMyCustomProxy""",0,0.5
I find it odd that it seems to ask for the 2010 build tools on the failing parts of the CI. I think there is something going wrong somewhere with that one,0,0.5
"From the binary log at <#url>, looks like Platform.Defaults.props ""wins"". That file uses #code if #code is empty. The setting in aspnetcoreCA.vcxproj is seen later and ""loses"" because a value is already set",0,0.5
"Bottom line, please add a #code property in src/Installers/Windows/AspNetCoreModule-Setup/CustomAction/aspnetcoreCA.vcxproj and set #code unconditionally. This will match the other native projects",0,0.5
what if you don't have a semantic model... feels super weird that this would be at the semantic model level,0,0.5
Consider any and all IDE features that do any sort of generation.  Previously there was no need to pass along any sort of compilation.  They could just use symbols,0,0.5
Note: this affects *public* APIs we've shipped.  These APIs would now seemingly become 'wrong' for any cases involving nullability.  taht concerns me greatly,0,0.5
"Conceptually, I'm not sure what separates this test from #code in terms of error messages. It also feels very wrong that the error message here mentions return types when they actually have nothing to do with what's wrong with the method, ie missing a yield statement",0,0.5
"More generally, I would not have expected this code to generate an error. I can make an async method just throw an exception the first line, and there will be a warning, but it will compile just fine. #Resolved",0,0.5
"This test name is wrong, this is about readonly members in a non-readonly struct",0,0.5
"I might be wrong here but if #code finds the first node that matches the span that it wouldn't work for situation where only the identifier is selected. That has pretty easy solution, however. (could simply test #code even for selection and proceed with this test only for situations where it doesn't return anything valuable)",0,0.5
@github Not sure how to tell the difference. Probably both,0,0.5
"Assuming that analyzer package is referenced by compiler toolset (correct me if that's wrong), there is no compiler toolset which references the new analyzer package that I need (since it's brand new)",0,0.5
"Are there other places where we do this kind of thing? I don't see any other places where we actually make use of the multiple-features thing. I understand how it works, but it feels gross. Can we put semicolons between them or something",1,0.5
"Ah, I've done something really stupid there haven't I",0,0.5
wtf how did that happen,1,0.5
That's really a terrible style IMO. 😄,1,0.5
Lack of braces makes various refactorings more complex and is one of the primary sources of bugs in a lot of C/C++ code,0,0.5
I have tested the multiplication on x64 and power.,0,0.5
The program works fine on x64 and does not work on power Below are the console and generated IL codes for both plaforms along with the small test program.,0,0.5
"The only thing which I can think of is, this is too hardware specific and while passing '0x0000271000000001' int64 parameter as int32 parameter to mono_is_power_of_two function, power is somehow making it to power of 2 which is not happening on x64",0,0.5
"Below are the IL code, on ppc64le multiplication instruction gets converted to left shift",0,0.5
"While checking what's consuming space this week in the AppData directory, I by chance came across this directory, and immediately warning bells started ringing. Both due to the size of the data it contained, and the name. ""RemoteWorkspace? Is this another data-exfiltration attempt without my consent?!"" was my first thought.",0,0.5
"Only (!) by doing a google search and by pure luck finding this very github issue did I find out that it's _yet another_ directory to maintain (clean out) where VS stores ton of junk",1,0.5
"Previously users knew about the option to delete the "".vs"" directory (and not infrequently got told by ""support"" to do so), but now there's yet _another_ directory, with a for-all-intents-and-purposes encrypted name, effectively **hidden** (worse, **intentionally** hidden) that I'm quite sure support don't have any idea whatsoever it even exists",0,0.5
"Some of the following could be considered ranting, but frankly I don't care anymore what you think when you dump waste products all over **my** storage, without neither my permission nor even the curtesy of telling me, much less providing the functionality to remove the crap",1,0.5
so who delete db file left out,0,0.5
No one. It's just a cache,0,0.5
"To quote a greater person than I am: ""You keep using that word. I don't think that word means what you think it means""",0,0.5
This is equiv to the data stored by many apps in the .appdata folder. It isn't intended to ever be touched our used by the user,0,0.5
"There's a helluva lot of difference between ""cache"" and ""Dumpingspace landfill we take the liberty to rip off from the users. Let's fill it with excrements and never clean it, then we call it a _cache_ and go MUAHAHAHAHA when the users diskspace is completely consumend so it can't even update neither VS nor Windows itself after a while!""",0,0.5
"I have only used this version for a few weeks and already this ""cache"" is over a quarter of a gigabyte. Extrapolate until the end of the year, and the system volume would have zero bytes free space. Guess how happy I am to find out this is _intentional_",0,0.5
