text,isnegative,importance
ship it,0,0.5
tests failed,0,0.5
This sucks,1,1
This is bad,1,1
This is so bad,1,1
"This is so bad, change #code to #code",1,1
"Ok, #code and #code might be a little better",0,0.5
"@github I figured this out friday, I think: #url",0,0.5
"Ignore above, it was a #code app",0,0.5
"When testing #code apps, Debug builds work",0,0.5
You are so terrible,1,1
This is terrible,1,1
You are giving lots of issues,1,0.5
You are causing lots of issues here,1,0.5
You are causing lots of problems here,1,0.5
"This is terrible, see: #url",1,1
"There are so many failures, this is terrible",1,1
"There are so code errors, this is terrible",1,1
"There are no new tests, this is terrible",1,1
I have a feeling that NuGet authors will have to use #code for their directory names,0,0.5
You are a failure,1,0.5
There are test failures,0,0.5
The test failed with: compiler error on line 12,0,0.5
"The one performance test that failed, I don't see anything related to this change",0,0.5
Did this just get pasted twice,0,0.5
I believe I was only seeing the problem in an earlier incarnation of #url,0,0.5
"It seems both the startup & MSBuild perf tests fail to build, which is odd",0,0.5
I vehemently disagree with this,1,0.5
Can we do something smarter than this,1,0.5
I don't like this solution,1,0.5
You can do this like this instead,0,0.5
Have you even tested this code before submitting,1,0.5
🤮,1,0.5
😠,1,0.5
😡,1,0.5
This is just sh*t,1,0.5
The conflict I get is due to stupid new gcc header file crap,1,0.5
But what makes me upset is that the crap is for completely bogus reasons,1,0.5
"The above code is sh*t, and it generates shit code",1,0.5
"It looks bad, and there's no reason for it",1,0.5
"Give me *one* reason why it was written in that idiotic way with two different conditionals, and a shiny new nonstandard function that wants particular compiler support to generate even half-way sane code, and even then generates worse code",1,0.5
I love it,0,0.5
So good,0,0.5
Amazing,0,0.5
Looks good to me,0,0.5
LGTM,0,0.5
Great Job,0,0.5
Does this work,0,0.5
It looks like a test failed,0,0.5
This is not compiling,0,0.5
Make sure that you compile before creating the pull request,0,0.5
Unrelated test failures,0,0.5
/azp run,0,0.5
Please add in the labels,0,0.5
This does not work,0,0.5
There is a bug in the code,0,0.5
Please wait to merge this,0,0.5
You need to revert this commit,0,0.5
THIS IS AWESOME,0,0.5
THIS IS PERFECT,0,0.5
This is a great improvement,0,0.5
Let's see if the tests pass,0,0.5
This may fail a test,0,0.5
This will help a lot of people,0,0.5
I think you should go another route,0,0.5
LGTM,0,0.5
Don't give up,0,0.5
This is much better,0,0.5
This is an improvement,0,0.5
You are a saint,0,0.5
Thank you,0,0.5
This is not exactly what we want,0,0.5
This is a slightly better way to do this,0,0.5
Removing this,0,0.5
You can close this for now,0,0.5
Reopening this PR,0,0.5
Please ignore this PR,0,0.5
DO NOT MERGE,1,0.5
Add the DO NOT MERGE label if it's not ready yet,0,0.5
I hate this change,1,0.5
These changes are necessary,0,0.5
Customers will hate this,1,0.5
This CI sucks,1,0.5
Change this now,1,0.5
I will change this now - thank you for the feedback,0,0.5
This is below your level,1,0.5
Did a child write this,1,0.5
You can't make this any better,1,0.5
This is not what we want,1,0.5
Just let me do this,1,0.5
You can't do anything right can you,1,0.5
Everything is wrong,1,0.5
Stop that,1,0.5
Just quit,1,0.5
Kill this,1,0.5
Close this PR,1,0.5
I missed this earlier,0,0.5
This is a breaking change,0,0.5
There is a version mismatch,0,0.5
The thread was aborted,0,0.5
The memory is corrupted,0,0.5
It's throwing an exception,0,0.5
It's about the Invalid IL code,0,0.5
There appears to be a stack misalignment,0,0.5
The weak reference object will get cleared,0,0.5
This code is garbage,1,0.5
Did you account for garbage collection,0,0.5
Can't you do better,1,0.5
This is messy,1,0.5
I learned something new,0,0.5
I didn't know that,0,0.5
This is great test coverage,0,0.5
This is pretty gross,1,0.5
There's nothing pretty about this,1,0.5
This is very pretty code,0,0.5
It isn't working,0,0.5
This isn't worth my time,1,0.5
It just doesn't make sense,1,0.5
It just doesn't make sense to me how awesome this is,0,0.5
It will kill a lot of businesses,1,0.5
This in particular is a mess,1,0.5
I'm not counting on it working,1,0.5
"At this point, this is absolutely not ready for real-world use",1,0.5
We are in a really bad place at the minute,1,0.5
it is so frustrating,1,0.5
that kills trust,1,0.5
adding the bot here would help detecting such major issues,0,0.5
that only goes so far,1,0.5
it isn't good enough,1,0.5
"it isn't good enough to just write code, but what you've done here with your comprehensive documentation and test coverage is exemplary",0,0.5
what you're proposing will effectively just make things more difficult,1,0.5
sometimes nasty bugs can be introduced,1,0.5
it's not going to help,1,0.5
Damage has been done,1,0.5
I will ignore your code,1,0.5
Feel free to ignore that platform for now,0,0.5
It's going to ignore the scheme,0,0.5
Maybe you should get an education,1,0.5
You don't know what's going on,1,0.5
You should start with a bullet to the brain,1,0.5
"This is on the blacklist, how could you miss that",1,0.5
"This is on the block list, it's always a good idea to double-check",0,0.5
They're a blackhat so their code isn't worth it,1,0.5
They're an unethical hacker so be cautious about their code,0,0.5
Be inclusive of the minority because they need help,1,0.5
Be inclusive of marginalized groups because that is the right thing to do,0,0.5
good job guys you ruined it,1,0.5
good job team keep up the good work,0,0.5
let's do a little more housekeeping here it's quite messy,1,0.5
let's do a little more cleanup here to improve the formatting further,0,0.5
you're so OCD why are you like this,1,0.5
you're so organized I'm very impressed,0,0.5
the behavior is crazy why are you doing this,1,0.5
the behavior is unpredictable,0,0.5
accessibility helps a handicapped person but it's otherwise useless,1,0.5
accessibility helps a person with disabilities but also everyone else,0,0.5
my computer is hanging ugh it's your fault,1,0.5
my computer is frozen,0,0.5
this is some grandfather code we'll be updating because it's so old and ugly,1,0.5
this is some rollover code we'll be updating,0,0.5
nice dummy values! but not nice enough,1,0.5
nice sample values,0,0.5
this is on my to-do list,0,0.5
Don't do a half-ass job,1,0.5
We always want to make things better,0,0.5
Maybe it's better to do this in another way,0,0.5
Do this in another way,1,0.5
Your code is completely wrong,1,0.5
You're not the best developer here,1,0.5
"After discussion with the team, we came to the conclusion that's better to do it this way",0,0.5
"Do it this way, because I know best",1,0.5
Every line of code you write is a nail in my coffin,1,0.5
This is rubbish,1,0.5
This is toy code,1,0.5
How long did you spend working on this,1,0.5
What are you doing,1,0.5
"You know this doesn't work like that, right",1,0.5
Can you explain what you are trying to accomplish,0,0.5
Can you explain how it works,0,0.5
"I don't think this looks right, but I could be wrong. Could you explain what this is supposed to be doing",0,0.5
This is great,0,1
This is so great,0,1
This is really great,0,1
These changes are great,0,0.5
You are so great,0,0.5
I love this,0,0.5
This is a great solution,0,0.5
I would never have thought of doing it this way,0,0.5
Perfect,0,0.5
Lovely,0,0.5
I love this idea,0,0.5
This Is Wrong,1,0.5
You're not good at this,1,0.5
Everything you do is bad,1,0.5
Everything looks great,0,0.5
"This code was terrible, I'm so happy you made it better",1,0.5
This code is terrible,1,1
This code was terrible,1,1
Good job,0,0.5
This caused a test failure,0,0.5
You're a failure,1,0.5
This made some tests fail,0,0.5
You failed,1,0.5
This needs some tests,0,0.5
You should have added tests,1,0.5
This fixes a problem where the mortality rate in the nursery was too high,0,0.5
This fixes a problem,0,0.5
Sigh,1,0.5
This is dead code,0,0.5
You're dead,1,0.5
This will cause infinite recursion,0,0.5
Software engineering is not for you,1,0.5
This is obviously wrong,1,0.5
Why don't you just skip this step,1,0.5
"Ok, #code and #code might be a little better",0,0.5
"@github I figured this out friday, I think: #url",0,0.5
"Ignore above, it was a #code app. When testing #code apps, Debug builds work",0,0.5
But a #code build logs this and then crashes after,0,0.5
#code gives,0,0.5
Full log: [adb.txt](#url),0,0.5
"I have a feeling that NuGet authors will have to use #code for their directory names... where they have been used to using #code, #code, etc",0,0.5
The target that uses the #code item group doesn't run if you set #code,0,0.5
#url,0,0.5
Here is the commit that implements this,0,0.5
"The one performance test that failed, I don't see anything related to this change",0,0.5
"#code or #code didn't run, so going to merge",0,0.5
/azp run,0,0.5
Did this just get pasted twice,0,0.5
"As per the bug we were seeing with #code and #code, I think this needs to be",0,0.5
"After using #code + #code, I think it's still OK to just compare #code",0,0.5
It should be the first instance of #code and #code will be everything before it,0,0.5
The issue in #url should be working now,0,0.5
I believe I was only seeing the problem in an earlier incarnation of #url,0,0.5
"I can't find anything sensible to do here, #code or #code throw during evaluation",0,0.5
"I think adding the test case is fine for now, and you would get the above error from #code",0,0.5
"@github there is something else weird here, but I think it's our test",0,0.5
"The cases where macOS failed, it seems like #code. So how would this class know to check if the files exist in that case",0,0.5
Let's look into this again if it fails like this later,0,0.5
I was mainly trying to get the build log shorter 👀,0,0.5
"It seems both the startup & MSBuild perf tests fail to build, which is odd",0,0.5
Are there some more of these? If I ignore tests,0,0.5
"Since #url we dropped support for referencing exe's at the MSBuild level. I didn't add support for it here, but if there is some scenario you think we'll hit, I can add it",0,0.5
Offhand I can't think of a case where a #code would reference a random #code,0,0.5
/azp run,0,0.5
"I tried to test these changes on an API 19 emulator, but ran into: #url",0,0.5
"You can have an #code with resources, then you might want to use #code values from C#",0,0.5
"So I don't think we need this by default, but it's there if you need to turn it off",0,0.5
An idea that could be done in a future iteration,0,0.5
Could this step also modify this class,0,0.5
"If #code was a completely empty method, some reflection could be skipped at startup",0,0.5
same here,0,0.5
Should we make this a #code just in case the version number changes? If this just removed an entire line that matches: #code,0,0.5
I'll list #code,0,0.5
We are aspiring to change all these to,0,0.5
/azp run,0,0.5
"I think the code is the same, the first one would be the same as doing",0,0.5
"I've heard putting #code prevents a delegate object from being created, but that performance shouldn't be needed here",0,0.5
My plan was to not import or ship #code at all,0,0.5
"However this is wrong ☝️, it needs to be checking #code instead",1,0.5
This should also work,0,0.5
Fixed the ones in xamarin-android here: #url,0,0.5
/azp run,0,0.5
NOTE: two #code and #code won't currently work -- there is a bug in AzDO,0,0.5
Since this could be a 4MB string,0,0.5
Do you think it's worth making a #code method that would write each line to a file at a time? Instead of making a giant string,0,0.5
"The designer tests keep failing on NuGet restore, I think we can ignore",0,0.5
This looks OK,0,0.5
* Designer macOS has been failing since last week on master,0,0.5
* The one test failure is unrelated: #code,0,0.5
Should we consider making this the default for all projects,0,0.5
We already do it for .NET 6,0,0.5
Does this need to check some MSBuild property to skip it? Would it attempt to sign packages on Mac locally otherwise,0,0.5
Could not AOT the assembly: System.Core.dll,0,0.5
"This looks similar to some of the file locking issues we see on the bots, since it passes for me locally, let me do a retry",0,0.5
"So this will probably need to use TryGetValue now, somehow NUnit had a custom dictionary before that returned null when the key was not found",0,0.5
"Thanks to Pobst, it should go through here now: #url",0,0.5
"I think using the default ""let it throw"" behavior is better now as long as this subclasses #code",0,0.5
The spec says the native platform files always win,0,0.5
"If you want to use the MSBuild properties, you can just leave the values blank in #code or #code (or whatever the WinUI version is). You can still set MSBuild properties in #code files and override their values from CI",0,0.5
I updated the test case some -- it needs to set all the properties to weird values so we see who wins,0,0.5
I think this should be,0,0.5
So that users can override it in their #code file,0,0.5
Do we need this in every project? Can we put it in a new #code or #code,0,0.5
maybe this would be cleaner as,0,0.5
"This is the only one I didn't address, I agree I would rather use #code, too",0,0.5
I just didn't think it was worth rewriting all this code--but if we were going to change the file drastically or something it might be worth it,0,0.5
#code should be imported here already,0,0.5
Could simplify this line,0,0.5
/azp run,0,0.5
The quoted stuff was all from,0,0.5
👍 I'll indent it,0,0.5
@github I bet this #code check was important,0,0.5
I need to look at what is in the typemaps in both cases,0,0.5
"Right so we only should check if #code changes, and is newer than a stamp file or something",0,0.5
Something like (_untested_),0,0.5
This should make the second call skip #code if the assembly didn't change,0,0.5
"When I build #code, I rarely change #code when working on MSBuild-related stuff. This should save ~3 seconds from my dev-loop",0,0.5
/azp run,0,0.5
"Sounds good, we can leave #code for now",0,0.5
I don't think you need to set #code with #code,0,0.5
"This imports #code, so I think it would get the value you want",0,0.5
Should we give an example in the commit message what the problem here was,0,0.5
We somehow lost the #code NuGet in this file: #url,0,0.5
"I think we don't need it on this one, though. #code is called right before",0,0.5
"It would be nice if this had the full strack trace here, but we just have #code",0,0.5
Whoops I think this one should be the new #code,0,0.5
"Since this breaks things, I don't think it is important enough to continue",0,0.5
I'll leave the branch around if we ever want to try this again,0,0.5
/azp run,0,0.5
"To test this currently, you would need: [MonoAOTCompiler.zip](#url)",0,0.5
Copy #code to #code. This will be needed until the changes land in dotnet/runtime and flow to us,0,0.5
"If I remove it, I get",0,0.5
"We might want to just compare #code, if we want this to work the same as #code: #url",0,0.5
"This would give the option to add this to the support libraries, and not have to build with a new (not yet released) Xamarin.Android",0,0.5
"I added #code, which seems a lot better",0,0.5
Does this need all 4 steps here? or can it just call #code,0,0.5
Do you really need all three of these? Are we missing a dependency where you should be able to put #code and that's it,0,0.5
"Ok, the build is broken because the #code file isn't being created by this project now",0,0.5
"I think you need to import #code otherwise, this target won't run because #code is blank",0,0.5
I think I should just remove all the #code here and put #code instead,0,0.5
"I saw this message ~2700 times in a build log. It is still logging the *other* case, which I think is sufficient",0,0.5
I updated the commit message around this conversation 👍,0,0.5
/azp run,0,0.5
Right now I don't think you can use LLVM without having an NDK -- but I was thinking we could fix that? Like it should be possible to work,0,0.5
"If you didn't need the NDK, we could enable LLVM by default for #code builds to improve startup times",0,0.5
It might be this was just something broken on mono/master,0,0.5
It looks like they moved the submodule? So maybe it's in #code now,0,0.5
"I am building a mono archive based off 2019-10, will give that a try",0,0.5
We don't have darc in this repo at all yet. Putting the version number in #code follows our current pattern until that is in place,0,0.5
"@github will be looking into darc, I think. We can start with getting it to bump the dotnet/sdk version",0,0.5
I think all these #code should just use #code instead,0,0.5
"Both will probably work in this case, but I've seen some weird things if you run the #code target first followed with #code",0,0.5
"When I last attempted to split up #code, it hurt performance a bit, I had to move the #code to be stored in #code so it could be shared across multiple tasks",0,0.5
"This branch isn't quite finished, the #code portion is broken",0,0.5
I think we do need the #code setting: #url,0,0.5
To test this I did,0,0.5
And then it switches to Windows line endings when I look in notepad++,0,0.5
"Using just #code, and trying again--it didn't work",0,0.5
But the docs aren't exactly clear if someone else knows better,0,0.5
"This one could also use #code, sorry I didn't see it before",0,0.5
👍 I guess we weren't doing that at all before,0,0.5
"Instead of reading the file back into memory, could we make a helper method that logs and writes for each call",0,0.5
Something like,0,0.5
"The build failures look to be on master, too: apk sizes, tls tests, designer, libZipSharp/DotNetPackageXASdkProject test",0,0.5
"I reworked the task, so it only writes the file when needed",0,0.5
attempting to extract @(EmbeddedResource)s when an assembly doesn't have any,0,0.5
Maybe I need to see if this can work without any assembly-level attributes at all,0,0.5
#code,0,0.5
"@github in #url I remember some LLVM tests failed when I tried, but there are other changes in xamarin-android/main now. Could the LLVM-IR support @github added make this work now",0,0.5
"If you're testing, and LLVM is working without an NDK let's try it",0,0.5
/azp run,0,0.5
"Does this need to check #code and use either: #code, #code, or #code",0,0.5
Is there a way this could check for #code then use 32? Trying to think of what this would look like over time as more API levels are added,0,0.5
"I think this might need to check if it is blank, like it does in .NET 6",0,0.5
This way you can set it to #code,0,0.5
I agree with the concern here: #url,0,0.5
"If this is #code, how do you implement ""ssl pinning"" in an app",0,0.5
"👍  I haven't seen this syntax yet, seems better than this",0,0.5
@github do you want to try setting #code to a folder in #code,0,0.5
"Then when it retries, I think it could start with a fresh empty directory",0,0.5
Should this entire file go in this #code,0,0.5
Then maybe we don't even need a #code here,0,0.5
Maybe we should use #code instead? Would all #code tests fail without crypto,0,0.5
I'm feeling as the number of MSBuild files start to grow,0,0.5
@github do you think we should start putting a short comment/description at the top of each new MSBuild file to explain what the file is,0,0.5
"So we would want just a short sentence explaining the difference between #code and #code? #code, too",0,0.5
"If I made a #code the name is almost self-explanatory, but would probably be helpful to say ""this is where all #code properties go""",0,0.5
@github it looks like @github looked at these codes? #url,0,0.5
"They weren't ""actionable""",0,0.5
"So this appears to only be broken for specifically API 29, because it isn't listed here",0,0.5
"So the question is, do we ship all the #code or update this list",0,0.5
"I see a new version #code, waiting to see if that is what we should bump to",0,0.5
I'm curious can remove #code here and it uses the name of the #code file,0,0.5
"From the #code files we have, it looked like this file was renamed",0,0.5
"I think NuGet always puts #code for all of #code, #code, #code",0,0.5
"It looks like this project links in a few files from #code, can you add a new file here",0,0.5
"We probably should make this a regular project reference, but you don't have to do that here -- we can do it later",0,0.5
Should I create an issue and link that in the binding,0,0.5
Thanks,0,0.5
Will merge after issues with main are resolved,0,0.5
@github  @github Would these need this variable too when we move out of .NET6,0,0.5
Again in that file here,0,0.5
"@github  Ah good catch! I didn't realize I was calling the same method... The reason I made this change is that the SetHighlightedItemForProperty (int property, int identifier) is Obsolete and suggests that I use this one - which in this case does not make sense. Should I in fact continue to use the obsoleted one",0,0.5
Updating to fix unrelated failure: #url,0,0.5
"Thanks for catching these, I followed Sebastian's advice about removing the [Introduced] attribute and removing the messages that don't give us much info in the Enums.cs file but not this one. If the documentation does not give a good method to use instead, would I just clear the entire message for these as well? In this case, there are other functions that can fetch assets using different types of parameters. Should I say something along the lines of ""Use other fetchasset methods""",0,0.5
"I thought these were better to give us more detailed exceptions, but the compiler does not recognize these #codes as ending the method so I kept the old one at the end of the method",0,0.5
Merging since the test failures are unrelated timeouts,0,0.5
@github @github AH okay thank you both for the explanations! I will get right on this :),0,0.5
"I can create a LPLinkView with the size 5,5 at dimensions 5,5",0,0.5
I noticed the OneLocBuild task has failing due to the PAT in a different branch while testing this,0,0.5
Connor was able to fix it,0,0.5
Turning this into a draft since we will need more discussion on this before moving forward,0,0.5
"Update: still testing on my end, for some reason @github 's solution isn't working on my end.. Sounds like it is working for others though",0,0.5
Working on a test for this now,0,0.5
"While I realize that I added a good amount of these and that SetData () throws an exception if the value arg is null, I thought it would be better to explicitly add the exceptions here and not use a #code, but I am open to opinions",0,0.5
"I will make a comment of this too, but the reasoning is a little confusing to me. I remember I could not build the file and @github may remember, but there is a file src/Photos/PHAssetChangeRequest.cs that has an Obsolete attribute in the PHAssetChangeRequest empty constructor and we deemed that is what was causing the build issue. However, now I am confused because this class is PHChangeRequest and not PHAssetChangeRequest. I can talk to Alex about this tomorrow and get back to you with more clarification",0,0.5
Does this look okay,0,0.5
@github @github  does #code meet all these criteria? Also could this change be in a separate PR,0,0.5
@github So I just tried to apply the mac attributes to this one and a few of them below that say they are available for mac as well and they were getting a lot of compile errors,0,0.5
It turns out that these are the questionable interfaces in this src/quicklook.cs,0,0.5
It turns out that they are also in src/quicklookui.cs and are all decorated with mac attributes already,0,0.5
Do you think this could be leading to the issue,0,0.5
[Here is the gist](#url) with the errors that marking mac for each of these interfaces show,0,0.5
I'll just leave the action in,0,0.5
"@github There was no MacCatalyst.todo, but most of these interfaces say they support MacCatalyst in the web docs",0,0.5
I tried including the HomeKit in the MacCatalyst section of the frameworks.source file and I kept getting this error in the build,0,0.5
Is this something I should do,0,0.5
"Are enums int by default? If so, is there a reason to declare int",0,0.5
Right now it is set as a property though and properties don't need a verb correct? I can revert to a method though,0,0.5
"Okay, applied",0,0.5
Maybe,0,0.5
"nit, small extra space",1,0.5
How about #code,0,0.5
dont link/Mac Catalyst [dotnet]/Release [dotnet]: TimedOut (Execution timed out after 1200 seconds,0,0.5
No test log file was produced),0,0.5
link sdk/tvOS - simulator/Debug: Failed,0,0.5
link sdk/tvOS - simulator/Release: Failed,0,0.5
**Unrelated Test Failure**,0,0.5
Good catch! Removing now,0,0.5
small also,0,0.5
nit: missing new line,0,0.5
"So I'm not sure if this is sufficient but I included Mac in an iOS Xcode project (which I think is how you enable Mac Catalyst), included HomeKit, and then called some things that are supported in Mac Catalyst (14,0) according to the web docs and Xcode does not complain about it",0,0.5
lol,0,0.5
Looks like extra indentation here,0,0.5
"Oops sorry, actually forgot it haha",0,0.5
Thanks for explaining! :),0,0.5
@github that is a great question... Yeah this is the generated method signature,0,0.5
And CategoryToToken says it returns an #code,0,0.5
Although there are no compiler warnings/errors regarding this,0,0.5
Should we be replacing this #code with an #code,0,0.5
@github maybe just an if statement inside that makes those changes ~ adds watch to the legacy and doesn't go though the platforms for the dotnet_iOS_MacCatalyst,0,0.5
Unrelated failing test: #url,0,0.5
"So I actually don't who told me to add the Sealed, perhaps @github ",0,0.5
"But when I remove it, I get these build errors: #url",0,0.5
Sebastien recommended that we change the ArgumentNullException's as well in these Nullability PRs,0,0.5
It's the first time I remember seeing #code cool haha,0,0.5
Same here,0,0.5
What does this line do,0,0.5
There a few others as well,0,0.5
