text,isnegative,importance
Hope this helps to clarify why the usage of that arguably very niche API in that library in particular 😊,0,0.5
This mildly concerns me - we've ran into insane bugs in the past where not zero-initializing something has resulted in bugs,0,0.5
"That first parameter being #code hits me 90% time when I use it, because I forget to pass #code here and then get stupid behavior a I have args shifted. This helps me a little bit, but I'm ok to revert it or to do something else, if you have an idea",0,0.5
"Consider a method that does 100 string comparisons against constant strings. Are all these 100 string comparisons going to be optimized, without hitting inliner's budget",0,0.5
"@github So the budget is common for all the callees for a specific root and it gets eaten very quickly with string.Equals, e.g",0,0.5
"Also, it would be interesting to measure JIT time of a method like this (before/after)",0,0.5
"since it can't do 100 Equals I don't see anything terrible and in general I guess there are not so many, I also tested the test I added - no visible effects",0,0.5
What is nice is that for non-unrollable cases jit ignores those calls as it is able to remove simple dead branches during import,0,0.5
"Any opinion on this? It feels great to be able to declare rules to unroll stuff in pure C# but yeah, several long equals can eat inliner's budget and we won't be able to inline other stuff in the current root",0,0.5
"Suggestion: Could we make all these offsets consts into an internal shared class that everybody links so that we can see the ordering in one place? It might sounds stupid, but it's really hard to think about the ordering of the system when it's distributed across classes. I also understand that this is kind of unrelated and a nit",0,0.5
Wow this is kinda gross 😄,1,0.5
"Noob question, the server and client OS share the same version prefix, so is it possible that windows 10/11 catch up with server? Or are these number incremented verry rarely. Like not on every windows update, but as a product version",0,0.5
Because I'm terrible at all the WPF stuff and didn't even realize I can do  #code? :),0,0.5
Thanks for the remind. This one is about allowing the core markdown renderer to display #code which is sanitized by #code. I'll revert the change for now and see ppl's feedback,0,0.5
wtf,1,0.5
Friday Spec Brownbag Quick Summary,0,0.5
Today we had a meeting about this spec. Here's some quick notes of how the discussion went,0,0.5
"- Unanimous ""launch inside the tab"", not a new window",0,0.5
Preview Window in Appearance Page,0,0.5
"- Unanimous yes. Do this. TermControl with a new connection that isn't real, just filled with some dummy sample text like what people might use (emojis, powerline fun, text tables, colors, etc.)",0,0.5
"- Automatic saving: No. We don't want to thrash the JSON file. If we had an in-memory model struct... maybe. Or if we were using a tear-off window, maybe",0,0.5
"- OK, Cancel, Apply and/or a ""Save"" button and a ""Preview Now"" button. No. Gross. Old. Maybe temporarily during the prototype so the person doing the prototype only has to write two event handlers. But no.",1,0.5
The preview window should be automagic on changes. The actual JSON should be written on Save button,0,0.5
"- We need a rocket ship icon for ""Launch""",0,0.5
(I didn't catch which one Leon was up with),0,0.5
- We don't think we have a readily available grid control,0,0.5
"- Commands with arguments that are already stringable by the command palette (e.g. new tab 1, new tab 2) are offered as drop down items",0,0.5
- Commands with arguments that are complex could be presented with a ... in the grid on the edge that launches a modal with the raw JSON to be edited,0,0.5
"- In the future, can migrate some of the ...s to launch a more robust editor based on the situation of the type of command, but default will allow raw editing if there is no specialty editor",0,0.5
- Concern with how to display/present the commands that people might not know about (easily buried in a dropdown/combo),0,0.5
"OK, so after talking this one out with other ppl on the team, I believe this was a stupid suggestion on my side",1,0.5
"IDEs ask for errors on files in no specific order. with this in place the error will keep appearing and disappearing randomly. i think we are better off having the error on every use. We already report errors on every use for decorators. so this should just be the same. I think we can just remove this check, and keep the error",0,0.5
Sorry for the bad suggestion,0,0.5
"Maybe separately, we should do better on tuples since this is so stupid",0,0.5
"I deleted the comment because we discussed it offline. To make you look less insane, I was asking why it wasn't called #code",0,0.5
"Tagging this ""needs design review"" for one concern about whether we want to be overloading go to _definition_ for this particular feature, since I don't think I would imagine this really correlates to a ""definition"" at all. We might be able to make some UI affordances to the user to help out what is going on (change the text of the right click menu to say ""go to control flow destination"" or something to that effect when you're actually on one of these tokens)",0,0.5
Also a few things that might be helpful,0,0.5
"1. Should invoking on return in a method jump to the invocation of that method if there's one, or show the selection if there's multiple? The local function case at least might be handy",0,0.5
"2. Should invoking throw jump to a catch block, at least if there's a matching one in the method? (The control flow analysis can of course get insane here but maybe the same-method case could still be useful....?) #Closed",0,0.5
"~The GitHub app is terrible so I can't review properly, but test 5 uses a function type returning #code. That's probably a mistake.~",0,0.5
"Yea, you could(should) definitely expose that method on AppKeyBindings. Parsing them again would be insane :P",0,0.5
"I'd rather you do it in this PR, rather than blocking your PR on mine getting in",0,0.5
"Thanks, @github",0,0.5
I've just tried the sequence of [the above GIF](#url) in a PowerShell,0,0.5
Then quickly minimized the window and nothing happens. I.e. nothing flashing,0,0.5
I'm using,0,0.5
Probably I'm just doing something stupid and/or missing some plain obvious things,0,0.5
Trying it from a [.NET console application](#url) with,0,0.5
also does not flash the task bar icon,0,0.5
"OK, I think I get it now",0,0.5
"The [""BellStyle"" setting](#url) was not set explicitly, thus resulting in only a sound (which was not hearable since I turned of all system sounds)",0,0.5
After configuring the CMD type to this,0,0.5
My C# console application was able to make the task bar flash/be lightened when using this,0,0.5
Resulting in this effect,0,0.5
"I'm still unable to do the same for PowerShell and #code but since I do need it for CMD only, not PowerShell, this is sufficient for me",0,0.5
"After reading [Dustin's reply](#url), this one worked correctly in PowerShell",0,0.5
This is a really gross pattern.  Can we rename this to something like EnsureInitialized and not do the ref to a field thing,1,0.5
"There is one ***huge*** issue with BigInteger as it stands currently, its default constructors",0,0.5
"The BigInt Class' constructors are all conversions to other datatypes making it inefficient and limited while BigInt *already* has a method coded in which uses *string* input **and is really what you should use when actually utilizing BigInt** called the #code method. The issue of the type conversion is *especially* magnetized for BigInt because of how it was intended for and why it was made, as the official microsoft documentation of BigInteger states (#url)",0,0.5
The BigInteger type is an immutable type that represents an arbitrarily large integer whose value in theory has no upper or lower bounds,0,0.5
"which is unlike every other type in the default constructor which means simply writing #code **will not** work because you aren't explicitly trying to convert the number to the #code datatype which also still has a max value, 179769313486231570814527423731704356798070567525844996598917476803157260780028538760589558632766878171540458953514382464234321326889464182768467546703537516986049910576551282076245490090389328944075868508455133942304583236903222948165808559332123348274797826204144723168738177180919299881250404026184124858368, but it is large enough to handle most things, however, numbers will not get automatically converted to double type, they need to be explicitly defined with the ""d"" suffix like #code but as double still has it's limits, this still goes against the purpose of Bignteger since as soon as you do #code the double datatype will stop working. The biggest ""*inexplicitly defined type*"" would be the uLong type which has the highest value of a measly #code. Since the constructor will always attempt to convert the number to a different type, as it stands it is",0,0.5
1. Inefficient; tries to convert the arguments to another datatype and go through their constructors which also will cause longer computation times and,0,0.5
"2. Has limitations; it will not work when trying to define an actual ""arbitrarily large integer"" like tested  by multiple people in this Stack Overflow question (#url)",0,0.5
"So these constructors go against how BigInt is supposed to be by design, a datatype for *arbitrarily large integers* and having numbers too big for the base constructor goes against what BigInt is supposed to be. However, BigInt *can* handle these ""arbitrarily large integers"" and *can* handle infinitely large things with the parse method. The #code method takes string arguments so it is theoretically infinite there and works properly. So why have that as just a method? Why not turn that into a constructor? Isn't that just stupid to not have it as a constructor if it literally satisfies what BigInt is supposed to be when as it currently stands does not? You already have all of the code for the #code method so why not just use it? Just copy + paste, anyone can do this! If the #code method *does* work as intended and how BigInt is supposed to be but the constructors can't, why wouldn't you just add the #code method as a constructor for string overloads",0,0.5
When can this fix be expected or is there a temporary workaround? Android user experience is terrible without this feature,0,0.5
"We are now ignoring ""unknown"" errors. There are no tests for this, because these errors are unknown and therefor we don't know how to reproduce it, but we definitely should not be swallowing these",0,0.5
"Assuming #code is 0 given an unkown error (which seems like a safe bet), then the error will get logged as a FIN which is terrible for debugging",0,0.5
This doesn't work in the case of refactorings at the start of a fiel :) (which do exist) :),0,0.5
I don't follow,0,0.5
Can you point to what you mean,0,0.5
"Imagine [this](#url) accepts null and we want to pass #code [here](#url) (carries info ""didn't register specific TextSpan"") .  The #code [just calls](#url) #code lambda with given parameters and so if we want to call it with #code the [lambda](#url) needs to be of type #code (has to accept nullable #code)",0,0.5
"The lambda, however, isn't an implementation detail. It gets set in [*public* constructor](#url). And that leaks the information that the registration should somehow work with Nullable #code 🤷‍♂️",0,0.5
"It's not terrible, nobody outside probably uses the constructor. But it _just feels weird_. Either have it nullable explicitly in #code (but that communicates wrong idea about it being optional) or have it nowhere",0,0.5
Note: we [still support](#url) the original constructor without #code parameter,0,0.5
"There should be no need for shift. Ideally, we could just ""subtract"" the modifier key from the keybinding. But would that be a difficult behavior to explain/understand",0,0.5
"I'm worried that might not totally work. Think of an insane person, who definitely wants to be able to select text with WASD, and an _interesting_ set of modifiers",0,0.5
"You can't really ""subtract shift"" from those modifiers 😕",0,0.5
"**edit:** everything is working now, see #url",0,0.5
"I took a pass at trying to get multi window saving working (didn't start on loading yet, which seems easier all things considered). The initial behavior that I started to implement was to just save the layout of all windows every #code seconds and/or when the last window closes",0,0.5
Roughly the architecture/call stack as currently implemented is,0,0.5
monarch app host calls GetAllWindowLayouts -> propagate to monarch -> for each peasant call GetWindowLayout -> peasant triggers GetWindowLayoutRequested -> window manager -> app host handles event -> calls logic/page -> back up to peasant -> monarch returns back down to app host -> call logic to save in ApplicationState,0,0.5
The WIP commit is #url,0,0.5
"I spend an excessive amount of time trying to get a stupid #code returned up the chain to the peasant, before  finally giving in and making a managed class that just wraps a string",0,0.5
"Unfortunately, I hit a wall as soon as I got the monarch window working because I needed to make the event async to handle switching to/from the ui thread since peasants on everyone except the monarch have different threads. This comment sums up my current thoughts and tribulations",0,0.5
"It is possible that after having looked at this for the last 8 hours I am getting tunnel vision and missing an easy answer, in which case I would love to hear it. Definitely open to ideas of other approaches",0,0.5
"ok, I'm stupid, is a key, I can't parse english: 'The **value** of this **key**'. To the value if a double",1,0.5
It should be. I cherry picked the commit,0,0.5
I didn't know about the forking and bots... I'm a noob with all this. Next time or should I create now,0,0.5
python3 wtf,1,0.5
Is there an easy way to run on the same hardware? Also do I need to manually patch bits and run before and after,0,0.5
"Would like a comment that this is test-only. I can imagine people doing really terrible things with this thinking this is a ""feature""",0,0.5
(but then I apparently ignored the rest of your comment because I'm stupid),1,0.5
"Yeah if it's a directory, I'd have like",0,0.5
#code <-- to explain WTF the files mean,1,0.5
or whatnot,0,0.5
"uint options seems correct since a C# int is a C long, so a C# uint is a C unsigned long",0,0.5
That is only true on Windows (i.e. C #code is always 32-bits). On non-Windows the #code is typically 32-bits on a 32-bit CPU and 64-bits on a 64-bit CPU. This is a terrible thing to discover so in .NET 6 we introduced [#code](#url). A big thanks to @github for pushing on it,0,0.5
The #code is correct,0,0.5
Okay so,0,0.5
1. this is insane,0,0.5
"2. it adds 90 test cases, so that makes me 😄",0,0.5
255 now that I went through all of the positions 😉. AND I still need to add some for word navigation,0,0.5
"3. I don't really know powershell all that well, but the code seemed easy enough to follow, and was documented well enough that I wouldn't totally hate myself if I needed to add another case",0,0.5
"4. this doesn't run automatically as part of the build, this has to be run manually. That definitely cuts down on some of the complexity, which is good. IMO generating the tests automagically as part of the build just ain't worth it",0,0.5
"Yeah, and we're not really changing these tests all the time. I did just add a ""nice to have"" where it all goes to a .g.cpp file though. So this process is now so much easier",0,0.5
"5. I'm not really going to inspect the veracity of the tests themselves. I'm gonna trust that you've done your diligence here. Manually inspecting 90 test cases probably isn't worth the time. Skimming them, they seem like they make sense",0,0.5
"6. There's a _lot_ of skipped tests, so helpfully we can fix those soon. Presumably, those are the ones that are failing currently. How did we come up with the test cases that are failing currently but shouldn't be? Just logically working out what they _should_ be doing? Was there some sort of reference app that you used to construct these cases? (this is merely a curiosity)",0,0.5
"Updated the README to talk a bit more about this, actually. There's kinda two types of tests that we're skipping for now",0,0.5
"1. we're wrong: I used MS Word to test what the behavior should be and added them to the CSV file as #code. Then, when they fail in TAEF, I double check that I translated MS Word correctly",0,0.5
"2. for #6986: we'll need _a lot_ of tests to make sure this works correctly. The idea here is that anything past the ""document end"" will be treated as a degenerate range at document end. So this is gonna be a really nice transition where I'll just update the CSV appropriately and generate/run the tests",0,0.5
"Oh, because I ran #code without actually telling it what ref to merge. WTF",1,0.5
"diff is terrible, but this code is almsot the same.  Generally the logic is similar to: if we have an initializer like #code leave it alone (we know the type of it). If we have #code change that to #code.  Otherwise, insert an explicit cast from the expression to the final local type.  This ensures the expr keeps the same meaning and affects code the same way in all the places it is inlined to",0,0.5
"aaaa I've not noticed that it was a #code project, sorry for stupid question",0,0.5
"OK, I found the problem -- I'm stupid, I forgot that the pull request that referenced this package hasn't been merged yet",1,0.5
"@github Comments from @github were only some renaming of tests and spacing, and discussion on certain doc comments. I tried to edit them from mobile, but hit the wrong buttons (it's really quite tricky to delete one line in a file)",0,0.5
"He has some other concerns about the api, but I'd think we shouldn't revisit the api right now. Could you resolve any open stuff please? It's terrible to do from mobile ;)",0,0.5
Shit. I guess I cannot pick this up,1,0.5
"Ah, crap, I forgot to fix this in the regular job. Will go do that now",0,0.5
"This doesn't seem like a terrible idea, though are you cool if we punt that for the v1 at least? That seems like refactoring we could come back through on a second pass and do 🤔",0,0.5
"Better than what we have now I suppose. Kinda gross to have 4, but it is what it is",0,0.5
#code means we're fine that inliner won't inline anything in cold blocks (call-sites with real profiles),0,0.5
"#code means it doesn't affect the BenefitMultiplier anyhow for cold blocks (so we still can inline calls in them). By default, I use #code as a balance",0,0.5
Here is the jit-diff (PMI mode) without taking PGO into account: #url,0,0.5
"Most of the size improvements come from ""don't inline anything in BBJ_THROW blocks"", e.g",0,0.5
both #code and #code aren't inlined anymore. A good example is  #code diff: #url,0,0.5
"There are some interesting examples where inlining leads to smaller size, e.g",0,0.5
"^ Inliner managed to detect foldable branches in the #code's constructor and inlined it, see [here](#url) and its [ctor](#url)",0,0.5
"Another example - it's now able to inline #code when we compare literals, e.g. #code is recognized as a foldable branch due to the fact we can now recognize 'get_Length' call, example",0,0.5
"There are some diffs due to PMI trying to instantiate #code with unsupported T (e.g. char) and inliner helpes here too, e.g. #url",0,0.5
#code is smaller after inlining: #url,0,0.5
"There are cases where ExtendedDefaultPolicy doesn't inline what was inlined by the previous inliner - I tried to avoid it, but there were cases where I'm not sure we should inline, e.g this call #url is inlined despite being quite complex: #url",0,0.5
"Old inliner detected here ""arg feeds const test"" and added a big multiplier. It did so because IL scan was not quite accurate and had many false positives. However, this method will still be inlined with PGO (and I am sure we have one for this in the static profile we ship). **UPD** I slightly added some boost in #url",0,0.5
These are the cases where inlining increases the size but hopefully for better performance,0,0.5
"InlineTree diff: #url It decided to inline #code here (e.g. because of ""non-generic code calls generic"")",0,0.5
Diff #url - it inlined all #code calls,0,0.5
"Overall I don't see anything terribly wrong so far (e.g. terrible spills because of too-many-locals), I spent the whole week on fixing the regressions and now it's more or less fine",0,0.5
"Performance benefits aren't as good as they used to be with a way more aggressive inliner but I'm going to investigate what exactly led to such improvements and send separate PRs. At least currently I don't see any impact on ""time to first request"", I'll publish the first results once my [script](#url) finishes",0,0.5
@github you can pick any method from the jit-diff and I'll explain with the diffs what exactly happened,0,0.5
gross. Can we think of better ways to organise and name this functionality,0,0.5
this seems like pretty gross overkill :D,0,0.5
"I would consider keeping this test as #code considering that the test above, #code, which uses a similar code minus the insane amount of dictionary instances, is already signaled to run on #code",0,0.5
Agreed. That sounds good,0,0.5
"Still, I need to destroy the old grid, right",0,0.5
"Correct, though all the views' DOM nodes would be reused: they would just be reparented",0,0.5
"Also, today, I don't really have call layout on the whole grid when moving things around. The code is a bit gross, but the grid seems to handle calling layout on the appropriate things so there are no issues. However it seems like I would have to call a top-level layout every time a part moves with this approach. Is that not more expensive",0,0.5
No need to call layout when the inside of the grid changes. The contract with layout is: you call it when the size (or position) of the entire grid box changes,0,0.5
"this was to appease github, which shows a terrible diff otherwise :'(",0,0.5
"Yeah, just the first time. I was mirroring the existing ""Enter outlining mode when files open"", though granted I think thats terrible wording too :)",0,0.5
The first change adds CNS_INT long 0 Fseq[_00] for source field in the field by field assignments even when offset is 0,0,0.5
"Hmm, I suspect that the ""proper"" way to do this is to add the address to the ""zero offset field map"". But then I happen to think that this kind of side maps are a terrible idea and that the it's best to keep this information in the IR, in special nodes - #code and #code. Basically #codes with field sequences but without suffering from #codes unary/binary split personality disorder. #code should do, with some extra special cases. Haven't checked the actual changes yet but I suppose you may want to make such nodes non-CSE, 0-size/execution cost, 0-level in eval order etc",0,0.5
"Optimize ADD(val, 0) in lower",0,0.5
Maybe this will also fix 13548,0,0.5
that's insane.. there should be a warning comment before every single local function,0,0.5
"Yeah this is a terrible hack. I think I'll open another PR first where I rename #code into something like ""UseAlphaForBackground(bool)"" or something. This change is needed, because this only works in #code due to random chance and depends on the fact that DxEngine defaults to ClearType, which AtlasEngine can't yet",1,0.5
"Urgh. Yeah, so there's 2 parts here",0,0.5
## anchorMode: Toggle,0,0.5
"I think where this spec stands, this is fine? You can just use your #code keybindings normally",0,0.5
## anchorMode: Hold,0,0.5
"The main idea behind ConHost CMD Mark Mode is basically that as long as <kbd>shift</kbd> is held, the 'start' endpoint is static/frozen/held",0,0.5
"I'm worried that might not totally work. Think of an insane person, who definitely wants to be able to select text with WASD, and an _interesting_ set of modifiers",0,0.5
"You can't really ""subtract shift"" from those modifiers 😕",0,0.5
"So, with the logic above, the scenario above might still be acceptable",0,0.5
"Alternatively, I feel like the safest option would be to have users specifically define controls in Mark Mode vs keyboard selection. I think that might be the _clearest_ way to fix the problem above, but I feel like there's a lot of repeated keybindings set between mark mode and non-mark mode ones. :/",0,0.5
"We could remove the ""anchorMode: Hold"". But then there's no way to replicate a _similar_ behavior to that of ConHost CMD. :( I also think the concept of ""hold"" is still a good one, but the execution is the tough part ugh",0,0.5
"ditto, stupid manuel",1,0.5
"Sorry, didn't see this. GitHub mobile does a terrible job of notifications :)",0,0.5
"The elastic annotation is added by #code which is called from the separated list constructor, so avoiding that by preserving the existing comma tokens solves this, and is much easier to boot",0,0.5
git,0,0.5
Why are you such a pain to talk to,1,0.5
You are a pain to me,1,0.5
I have no faith in you,1,0.5
I have no faith in this code,1,0.5
"I like the way you code, you got this",0,1
I have no faith in this at all,1,0.5
#url,0,0.5
note: as per my conversation with @github i think the case that VB is handling is incredibly esoteric. I would be ok with having VB just checking for that case and not offerring invert-if if it helps simplify the rest of the algorithms here. I think it's a practically irrelevant case in practice and i would be fine with no invert-if for it,1,0.5
This is an unfortunate consequence of having PRs drag on for so long.  We literally forget about the conversations we've had on these very topics. :),1,0.5
@github This local variable will be released in the end of method with the help of garbage collector,0,0.5
